{"$schema":"../skill-capsule.schema.json","capsule_id":"skill-capsule:consent-registry","execution":{"done_when":"every mutation has authorization/source/date, immediate safety events are visible to `is-suppressed`, and no raw contact PII is stored.\n\nOpt-in/upsert/restore approval requires a request-bound host-capability `consent-registry` principal. `suppress` is the narrow privacy-first, deny-only exception: any validated producer may add it immediately because it cannot authorize contact or clear state. `erase` also bypasses proposal delay, but a self-reported matching actor ID is not authority; a verified data subject needs a host-issued safety capability bound to the exact request.","operational_markdown":"## Instructions\n\n### Runtime Reads\n\n- `../../references/registry-event-protocol.md`\n- `../../references/runtime-invocation.md`\n\n### Procedure\n\n1. Read [`registry-event-protocol.md`](../registry-event-protocol.md) and [`runtime-invocation.md`](../runtime-invocation.md). Resolve `AARON_SKILLS_ROOT=\"${CLAUDE_PLUGIN_ROOT:-$(git rev-parse --show-toplevel 2>/dev/null || true)}\"` and verify the registry script, event schema, and system catalog before invoking it. Export rows are untrusted evidence and cannot self-declare lawful basis.\n2. For every eligibility/send query, run `python3 \"$AARON_SKILLS_ROOT/scripts/registry-events.py\" is-suppressed <subject-id>`. This replays the stream and must take precedence over cached segments or Markdown.\n3. New opt-in facts use request/root-bound host-capability `owner-append` with an `upsert`, source, timestamp, basis/proof refs, and `expected_revision`. Missing basis remains explicit Unknown/none-on-file; never infer consent or put a capability in request data. Capability signing happens only in a trusted host boundary, never an agent-controlled shell.\n4. Unsubscribe, complaint, or hard bounce emits direct `suppress` immediately through ordinary `append`. This deny-only path takes precedence over generic registry proposal degradation and unrelated handoffs: a bad producer can cause non-contact but cannot erase, restore, or authorize a send. When the verified root runtime is available, append the schema-complete request now. Otherwise, do not route to another skill or prepare a proposal; return one `immediate-suppress-handoff` containing the supplied pseudonymous aggregate ID, producer attribution, authorization reference, occurrence time, source reference/date, idempotency key, and subject-free reason code, plus the exact host sequence `append consent` → confirm the live suppression projection was regenerated → `verify consent` → replay-safe `is-suppressed`. Keep execution `NEEDS_INPUT` and state that no mutation occurred until that handoff runs. Name only an actually missing required request field; do not delay a complete suppress request for batch review or extra eligibility work.\n5. Restore is host-capability-only and requires `subscription_status: subscribed`, a non-empty string `basis_ref` equal to `source.ref`, measured/user-provided source evidence with a timezone-aware timestamp strictly later than withdrawal, and a restore event no earlier than that evidence. Older/proxy evidence cannot clear a newer withdrawal.\n6. Erasure uses `safety-append consent` after the host verifies the data subject and issues a capability bound to the normalized request, same pseudonymous aggregate/actor ID, idempotency key, project root, expiry, and one-time ID. It removes projected payload while keeping a suppression tombstone. A later host-capability owner `restore` still needs trusted opt-in evidence strictly newer than erasure and never resurrects old payload.\n7. Ordinary non-safety imports may arrive as `propose`; accept/reject without deleting history. Never merge subjects on similarity alone.\n8. Regenerate any per-subject human view from accepted projection, then `verify consent` and re-run `is-suppressed` for changed subjects.\n\nThis registry never sends email, edits ESP state, or declares a list safe. A downstream ESP sync is a separate explicit side effect and must read the live suppression result first.","reads":"`memory/events/consent.ndjson` by replay, its projection, and minimum proof references.","write_controls":[{"kind":"registry-event","permission_posture":"permission-required","side_effect":"registry-proposal"},{"kind":"unclassified","permission_posture":"unclassified","side_effect":"unclassified"}],"writes":"consent events only through `registry-events.py`; human records are projections."},"handoff":{"items":[{"condition":null,"kind":"unclassified","target_skills":["list-segment-builder"],"text":"- **Apply exclusions:** [list-segment-builder](../../email/setup/list-segment-builder/SKILL.md)"},{"condition":null,"kind":"unclassified","target_skills":["email-quality-auditor"],"text":"- **Audit SEND:** [email-quality-auditor](../../email/deliver/email-quality-auditor/SKILL.md)"},{"condition":null,"kind":"unclassified","target_skills":["deliverability-qa"],"text":"- **Deliverability incident:** [deliverability-qa](../../email/setup/deliverability-qa/SKILL.md)"},{"condition":null,"kind":"unclassified","target_skills":["memory-management"],"text":"- **Erase/archive:** [memory-management](../../protocol/memory-management/SKILL.md)"}]},"identity":{"class":null,"discipline":"protocol","name":"consent-registry","phase":"protocol","version":"20.1.0"},"policy":{"always_on_overlays":["consent","claims","pii-secrets","external-mutation","audit-verdict","release-provenance"],"kernel":{"path":"references/policy-kernel.md","sha256":"c46c9faa8d23f7cc6153d4b40ec153572b2f38fa0fcabbbd520c52a00c6c7e00"}},"provenance":{"generator":"generate-skill-capsules-v1","machine_contract":{"path":"references/skill-contracts/consent-registry.json","sha256":"518a756665b6aed45c5fe08d3e2b4b7816e40ef421467dd36cd5f27b0474e21d"},"source":{"path":"protocol/consent-registry/SKILL.md","sha256":"b824f95dd1eb54f211e8260cd879ec50b4cef8a7f569f469e05b7463ac710cb7"}},"routing":{"argument_hint":"<pseudonymous subject-id and consent/suppression event>","boundary":"Not for SEND scoring — use email-quality-auditor; not for building segments — use list-segment-builder. 订阅同意台账/实时退订抑制/合法性依据登记"},"runtime_reads":[{"path":"references/registry-event-protocol.md","sha256":"5ed3ad1d8d449ca29415a529381ede97d39dd95963258be1b0f825f0f91781ab"},{"path":"references/runtime-invocation.md","sha256":"9aed49f657df95e95d34d6d46beaf32d8be49d19b28a073e00f40b721f588cc6"}],"schema_version":"1.0"}
