{"$schema":"../skill-capsule.schema.json","capsule_id":"skill-capsule:brief-generator","execution":{"done_when":"- The brief covers all required sections (overview, key messages, deliverables, creative direction, timeline, compliance, compensation, contact).\n  - Disclosure requirements and usage rights are stated explicitly, with no placeholder left unresolved that the user gave input for.\n  - Deliverables and quantities match what the user requested per platform.\n  - Key messages derive from accepted Narrative canon, claims are context-valid or visibly blocked, and the dependency tuple is present.","operational_markdown":"## Instructions\n\nWhen a user requests a brief:\n\n1. **Gather brief inputs** — capture campaign info, deliverables, key message, CTA, timeline, and compensation; resolve HOT pointers to their actual source records. Read Narrative/claims projections at named offsets. If creator voice is required, capture it via [creator-voice-intake.md](../../influencer/target/brief-generator/references/creator-voice-intake.md).\n2. **Generate the professional brief** — fill the master template and tune it to the platform. Derive key messages from accepted canon and context-valid claims. Mark unresolved wording `[needs source]`, submit it through `registry-events.py` as an authorized `operation: propose` event, and prevent creator-ready status until resolved.\n3. **Apply content-type and campaign-type variations** — adjust emphasis per platform (TikTok hook/sounds, IG Reels/Stories/Feed, YouTube integration/Shorts) and per campaign type (launch, review, event, ambassador, giveaway). Variation tables: [references/brief-templates.md](../../influencer/target/brief-generator/references/brief-templates.md#brief-variations-by-content-type).\n4. **Save and route** — after permission, write the finished brief with canon/version/claims-offset fields. Durable creator, channel, claim, or campaign facts route to their owning registry as proposals; do not write HOT or canonical views automatically.\n\nDisclosure and usage rights must be stated explicitly — never leave them as placeholders once the user has given input. Briefs are guidelines, not scripts: respect the creator's voice while pinning the key messages and compliance terms.\n\n## Example\n\n**User**: \"Create a brief for micro-influencers to promote our new organic protein powder on Instagram and TikTok\"\n\n**Output**: Complete brief — messaging around organic ingredients and clean label, deliverables of 1 IG Reel + 1 TikTok video with platform specs, creative direction for \"morning routine\" / \"workout fuel\" angles, timeline with draft + go-live dates, #ad disclosure at caption start, and 12-month repost/paid usage rights. Saved to `memory/influencer/brief-generator/`.","reads":"campaign/product/platform/deliverable/CTA/timeline/compensation inputs plus `memory/projections/narrative.json`, `memory/projections/claims.json`, and relevant creator/channel projections; HOT is only an index to those sources.","write_controls":[{"kind":"project-artifact","permission_posture":"permission-required","side_effect":"project-write"},{"kind":"unclassified","permission_posture":"unclassified","side_effect":"unclassified"}],"writes":"a creator-ready brief in conversation and, with permission, `memory/influencer/brief-generator/YYYY-MM-DD-<topic>.md`; unresolved claims become authorized claims proposals."},"handoff":{"items":[{"condition":null,"kind":"primary","target_skills":["budget-optimizer"],"text":"- **Primary**: [budget-optimizer](../../influencer/target/budget-optimizer/SKILL.md) - Once the brief defines deliverables, set how spend is split across creators and platforms."},{"condition":null,"kind":"unclassified","target_skills":[],"text":"- **Alternates (same Target family)**:"},{"condition":"if the brief surfaces new deliverable needs.","kind":"unclassified","target_skills":["campaign-planner"],"text":"- [campaign-planner](../../influencer/target/campaign-planner/SKILL.md) - Re-plan campaign scope if the brief surfaces new deliverable needs."},{"condition":null,"kind":"unclassified","target_skills":["outreach-manager"],"text":"- [outreach-manager](../../influencer/activate/outreach-manager/SKILL.md) - Send the finished brief to selected creators."},{"condition":"If a recommended skill was already invoked this session, stop and report chain-complete instead of re-running it. Cap any handoff chain at max-depth 3.","kind":"unclassified","target_skills":[],"text":"**Termination note**: Maintain a visited-set. If a recommended skill was already invoked this session, stop and report chain-complete instead of re-running it. Cap any handoff chain at max-depth 3."}]},"identity":{"class":null,"discipline":"influencer","name":"brief-generator","phase":"target","version":"20.0.0"},"policy":{"always_on_overlays":["consent","claims","pii-secrets","external-mutation","audit-verdict","release-provenance"],"kernel":{"path":"references/policy-kernel.md","sha256":"cfcd47b6284b654d30f34c26aa6df22476127dd4fa8279ba9030a8dc221aa5e3"}},"provenance":{"generator":"generate-skill-capsules-v1","machine_contract":{"path":"references/skill-contracts/brief-generator.json","sha256":"c7f9174715553f57b7b4b687b65093e7de7ede3617abec71a4d47cef29c78127"},"source":{"path":"influencer/target/brief-generator/SKILL.md","sha256":"23047db533f0d95664cbf8f44bea24bcfaa1e9376876cf1eaa09005f701c0a86"}},"routing":{"argument_hint":"<campaign or product> [platform] [content type]","boundary":"Not for choosing how to split spend across creators — use budget-optimizer. 达人合作简报/创作者BF"},"runtime_reads":[],"schema_version":"1.0"}
