{"$schema":"../skill-capsule.schema.json","capsule_id":"skill-capsule:competitor-tracker","execution":{"done_when":"1. Each tracked competitor has a partnership roster and campaign breakdown with sources or stated estimates.\n  2. A side-by-side comparison table covers your brand plus every competitor.\n  3. At least 3 ranked opportunities (untapped creators, strategy gaps, or open platforms) are listed.","operational_markdown":"## Instructions\n\nEach step has a fill-in template in [references/templates.md](../../influencer/target/competitor-tracker/references/templates.md).\n\n1. **Define competitive set** — capture your brand, prioritized competitors (direct/indirect), platforms, time period, and focus areas. ([template](../../influencer/target/competitor-tracker/references/templates.md#1-define-competitive-set))\n2. **Track influencer partnerships** — for each competitor, build a current/recent partner roster (handle, platform, followers, partnership type, duration), then the observed selection criteria, relationship-type mix, partnership frequency, and notable partners. ([template](../../influencer/target/competitor-tracker/references/templates.md#2-track-influencer-partnerships))\n3. **Analyze campaigns** — break down recent campaigns (timeline, platforms, tier mix, content type, hashtag, CTA, estimated spend, what worked/didn't), plus a calendar and seasonal/launch patterns. ([template](../../influencer/target/competitor-tracker/references/templates.md#3-analyze-campaigns))\n4. **Review content strategy** — log format preferences, content themes, messaging, hashtag strategy, and creative direction. ([template](../../influencer/target/competitor-tracker/references/templates.md#4-review-content-strategy))\n5. **Estimate performance** — estimate overall program metrics, performance by platform and by tier, and top/underperforming content. Mark every figure as an estimate. ([template](../../influencer/target/competitor-tracker/references/templates.md#5-estimate-performance))\n6. **Generate competitive comparison** — a side-by-side table (your brand + every competitor), a strategy-element matrix, and a share-of-voice bar. ([template](../../influencer/target/competitor-tracker/references/templates.md#6-generate-competitive-comparison))\n7. **Identify opportunities** — rank untapped and former-competitor creators, strategy gaps, and platform/niche/format openings (at least 3 ranked). ([template](../../influencer/target/competitor-tracker/references/templates.md#7-identify-opportunities))\n8. **Generate insights report** — executive summary, strategic recommendations (immediate/short/long-term), tracking recommendations, and next review date. Save to the memory path above. ([template](../../influencer/target/competitor-tracker/references/templates.md#8-generate-insights-report))\n\n## Worked Example\n\n**User**: \"Track the influencer marketing activities of Glossier, Fenty Beauty, and Rare Beauty\"\n\n**Output**: Competitor analysis showing Glossier's UGC-heavy approach, Fenty's diverse creator network, Rare Beauty's mental health-focused partnerships, with identified gaps and ranked opportunities. Full invocation patterns, \"what this skill does\", and tips for success live in [references/templates.md](../../influencer/target/competitor-tracker/references/templates.md#when-to-use-this-skill).","reads":"your brand name, the competitor set, platforms to monitor, time period, focus areas (partnerships/campaigns/content/all). Public creator handles and post data the user supplies or that ~~social platform analytics returns.","write_controls":[{"kind":"project-artifact","permission_posture":"permission-required","side_effect":"project-write"}],"writes":"a competitive intelligence report saved to `memory/influencer/competitor-tracker/YYYY-MM-DD-<topic>.md` (partnership roster, campaign analysis, content-strategy review, performance estimates, side-by-side comparison, opportunity list)."},"handoff":{"items":[{"condition":null,"kind":"primary","target_skills":["campaign-planner"],"text":"- **Primary**: [campaign-planner](../../influencer/target/campaign-planner/SKILL.md) — turn competitive gaps into a differentiated campaign."},{"condition":null,"kind":"unclassified","target_skills":["influencer-discovery"],"text":"- **Alternate (Scout)**: [influencer-discovery](../../influencer/scout/influencer-discovery/SKILL.md) — pursue the untapped and former-competitor creators this analysis surfaced."},{"condition":"before you poach.","kind":"unclassified","target_skills":["fit-scorer"],"text":"- **Alternate (Scout)**: [fit-scorer](../../influencer/scout/fit-scorer/SKILL.md) — score a competitor's roster against your brand before you poach."},{"condition":"If the next skill has already run this session, stop and report the chain complete instead of re-invoking. Max chain depth is 3 hops.","kind":"unclassified","target_skills":[],"text":"Termination note: keep a visited-set of skills invoked this session. If the next skill has already run this session, stop and report the chain complete instead of re-invoking. Max chain depth is 3 hops."}]},"identity":{"class":null,"discipline":"influencer","name":"competitor-tracker","phase":"target","version":"20.0.0"},"policy":{"always_on_overlays":["consent","claims","pii-secrets","external-mutation","audit-verdict","release-provenance"],"kernel":{"path":"references/policy-kernel.md","sha256":"cfcd47b6284b654d30f34c26aa6df22476127dd4fa8279ba9030a8dc221aa5e3"}},"provenance":{"generator":"generate-skill-capsules-v1","machine_contract":{"path":"references/skill-contracts/competitor-tracker.json","sha256":"dd92e153700ea09e6379b8c50c15f7e368c011ad676f0ecee30295b50bc79ab3"},"source":{"path":"influencer/target/competitor-tracker/SKILL.md","sha256":"6b4ce244656d7cbfc5f486112699171bc5c9d5ac05c1655fdd18f29c07afbd5a"}},"routing":{"argument_hint":"<your brand> [competitor names] [platform]","boundary":"Not for finding your own new creators — use influencer-discovery. 竞品达人合作追踪/竞品营销分析"},"runtime_reads":[],"schema_version":"1.0"}
