{"$schema":"../skill-capsule.schema.json","capsule_id":"skill-capsule:rank-tracker","execution":{"done_when":"every tracked keyword shows current position vs baseline with a labeled delta (or N/A); each position cites its source (tool export / user-provided / estimated); and biggest movers and likely causes are named.","operational_markdown":"## Decision Gates\n\n**Stop and ask the user when:**\n- No target keywords are provided and none can be inferred from `CLAUDE.md` or prior monitoring records — offer: (1) supply a keyword list, (2) track the domain's top known terms, (3) cancel.\n\n**Continue silently (never stop for):**\n- No prior baseline exists — record the current run as the baseline, label all positions as the first snapshot, and proceed (do not invent a \"previous\" position).\n- Missing optional tool data (SERP features, AI citations) — mark N/A and proceed.\n\n## Instructions\n\nWhen a user requests rank tracking or analysis:\n\n1. **Set Up Keyword Tracking** — configure domain, market, device, language, update frequency, priorities, and competitor watchlist.\n2. **Record Current Rankings** — output a position table where every row cites its source (tool export / user-provided / estimated), with position ranges, ranking URLs, feature ownership, and movement vs baseline.\n3. **Analyze Ranking Changes** — highlight biggest wins, declines, stable terms, new rankings, lost rankings, likely causes, and recovery ideas; each delta labeled against its baseline.\n4. **Track SERP Features** — compare ownership of snippets, PAA, image/video packs, local packs, and related feature shifts.\n5. **Track GEO / AI Visibility** — monitor AI Overview presence, citation rate, citation position, and trend; mark each value Measured (from an ~~AI monitor) or N/A if unobserved.\n6. **Compare Against Competitors** — report share of voice, head-to-head comparisons, and threat levels.\n7. **Generate Ranking Report** — output overall trend, key wins, concerns, opportunities, SERP feature changes, GEO visibility, and recommendations, with each metric carrying its source tag.\n\nLabel every metric **Measured** (tool/export), **User-provided**, or **Estimated** (model inference); never present an estimate as measured; if a required metric is unavailable, mark it N/A — do not invent it.\n\n> **Reference**: See [Ranking Analysis Templates](../../seo-geo/evaluate/rank-tracker/references/ranking-analysis-templates.md) for the complete output templates for all seven steps.\n\n## Example\n\nA ranking report names the biggest winners, biggest drops, and next actions, with each position carrying its source tag and labeled delta against baseline.\n\n## Rank Change Quick Reference\n\n### Response Protocol\n\n| Change | Timeframe | Action |\n|--------|-----------|--------|\n| Drop 1-3 positions | Wait 1-2 weeks | Monitor — may be normal fluctuation |\n| Drop 3-5 positions | Investigate within 1 week | Check technical issues and competitor changes |\n| Drop 5-10 positions | Investigate immediately | Run a full diagnostic: technical, content, links |\n| Drop off page 1 | Emergency response | Comprehensive audit + recovery plan |\n| Position gained | Document and learn | Identify what worked and replicate |\n\n> **Reference**: See [Tracking Setup Guide](../../seo-geo/evaluate/rank-tracker/references/tracking-setup-guide.md) for tracking setup, root-cause taxonomy, CTR benchmarks, SERP feature impact, and algorithm-update assessment.\n\n### Save Results\n\nAsk \"Save these results?\" If yes, write to `memory/monitoring/` — see [Skill Contract](../skill-contract.md) §Save Results Template.","reads":"current rankings, prior baselines, target keyword list, market/device, and any user-provided or tool metrics.","write_controls":[{"kind":"unclassified","permission_posture":"unclassified","side_effect":"unclassified"}],"writes":"a user-facing monitoring deliverable and reusable summary."},"handoff":{"items":[{"condition":null,"kind":"unclassified","target_skills":["performance-monitor"],"text":"Initial setup (no baseline) → [performance-monitor](../../seo-geo/evaluate/performance-monitor/SKILL.md). Subsequent runs (baseline exists) → Terminal. Visited-set rule applies per [skill-contract.md](../skill-contract.md)."}]},"identity":{"class":null,"discipline":"seo-geo","name":"rank-tracker","phase":"evaluate","version":"20.0.0"},"policy":{"always_on_overlays":["consent","claims","pii-secrets","external-mutation","audit-verdict","release-provenance"],"kernel":{"path":"references/policy-kernel.md","sha256":"cfcd47b6284b654d30f34c26aa6df22476127dd4fa8279ba9030a8dc221aa5e3"}},"provenance":{"generator":"generate-skill-capsules-v1","machine_contract":{"path":"references/skill-contracts/rank-tracker.json","sha256":"900a8e9219c6b62ca441afc317877c73a3bef590bc00eec7d2a04ccb942acf1a"},"source":{"path":"seo-geo/evaluate/rank-tracker/SKILL.md","sha256":"7d7f35a4a8a305bda5b7886394bfb08ab803e424c61a209388fbcd755b9228cc"}},"routing":{"argument_hint":"<domain> [keyword list]","boundary":"Not for multi-metric stakeholder reports or setting alerts — use performance-monitor (report or alert mode). 排名追踪/SERP监控"},"runtime_reads":[],"schema_version":"1.0"}
